<?xml version="1.0" encoding="UTF-8"?>
<QUANAN xmlns:xsi="http://www.w3.org/2001/XMLSchema-instance"
         xsi:noNamespaceSchemaLocation="QUANAN.xsd">

  <!-- DANH SÁCH BÀN -->
  <BANS>
    <BAN>
      <TENBAN>B01</TENBAN>
      <SOBAN>1</SOBAN>
    </BAN>
    <BAN>
      <TENBAN>B02</TENBAN>
      <SOBAN>2</SOBAN>
    </BAN>
    <BAN>
      <TENBAN>B03</TENBAN>
      <SOBAN>3</SOBAN>
    </BAN>
    <BAN>
      <TENBAN>B04</TENBAN>
      <SOBAN>4</SOBAN>
    </BAN>
    <BAN>
      <TENBAN>B05</TENBAN>
      <SOBAN>5</SOBAN>
    </BAN>
  </BANS>

  <!-- DANH SÁCH NHÂN VIÊN -->
  <NHANVIENS>
    <NHANVIEN>
      <MANV>NV01</MANV>
      <TENNV>Nguyen Van A</TENNV>
      <SDT>0912345678</SDT>
      <DIACHI>Can Tho</DIACHI>
      <GIOITINH>Nam</GIOITINH>
      <USERNAME>nguyenvana</USERNAME>
      <PASSWORD>password123</PASSWORD>
    </NHANVIEN>
    <NHANVIEN>
      <MANV>NV02</MANV>
      <TENNV>Le Thi B</TENNV>
      <SDT>0987654321</SDT>
      <DIACHI>Vinh Long</DIACHI>
      <GIOITINH>Nu</GIOITINH>
      <USERNAME>lethib</USERNAME>
      <PASSWORD>abc1234567</PASSWORD>
    </NHANVIEN>
    <NHANVIEN>
      <MANV>NV03</MANV>
      <TENNV>Tran Van C</TENNV>
      <SDT>0901112233</SDT>
      <DIACHI>Soc Trang</DIACHI>
      <GIOITINH>Nam</GIOITINH>
      <USERNAME>tranvanc</USERNAME>
      <PASSWORD>securepass99</PASSWORD>
    </NHANVIEN>
    <NHANVIEN>
      <MANV>NV04</MANV>
      <TENNV>Pham Thi D</TENNV>
      <SDT>0909998888</SDT>
      <DIACHI>Can Tho</DIACHI>
      <GIOITINH>Nu</GIOITINH>
      <USERNAME>phamthid</USERNAME>
      <PASSWORD>passlong1234</PASSWORD>
    </NHANVIEN>
    <NHANVIEN>
      <MANV>NV05</MANV>
      <TENNV>Vo Van E</TENNV>
      <SDT>0977334455</SDT>
      <DIACHI>Hau Giang</DIACHI>
      <GIOITINH>Nam</GIOITINH>
      <USERNAME>vovane</USERNAME>
      <PASSWORD>mypassword11</PASSWORD>
    </NHANVIEN>
  </NHANVIENS>

  <!-- DANH SÁCH MÓN -->
  <MONS>
    <MON>
      <MAMON>M01</MAMON>
      <TENMON>Com chien</TENMON>
      <GIA>50000</GIA>
      <HINHANH>comchien.jpg</HINHANH>
    </MON>
    <MON>
      <MAMON>M02</MAMON>
      <TENMON>Mi xao</TENMON>
      <GIA>45000</GIA>
      <HINHANH>mixao.jpg</HINHANH>
    </MON>
    <MON>
      <MAMON>M03</MAMON>
      <TENMON>Hu tieu</TENMON>
      <GIA>40000</GIA>
      <HINHANH>hutieu.jpg</HINHANH>
    </MON>
    <MON>
      <MAMON>M04</MAMON>
      <TENMON>Ca kho</TENMON>
      <GIA>55000</GIA>
      <HINHANH>cakho.jpg</HINHANH>
    </MON>
    <MON>
      <MAMON>M05</MAMON>
      <TENMON>Canh chua</TENMON>
      <GIA>60000</GIA>
      <HINHANH>canhchua.jpg</HINHANH>
    </MON>
  </MONS>

  <!-- DANH SÁCH HÓA ĐƠN -->
  <HOADONS>
    <HOADON>
      <SOHD>1</SOHD>
      <NGAYLAP>2025-10-01</NGAYLAP>
      <TONGTIEN>150000</TONGTIEN>
      <MANV>NV01</MANV>
      <TENBAN>B01</TENBAN>
    </HOADON>
    <HOADON>
      <SOHD>2</SOHD>
      <NGAYLAP>2025-10-02</NGAYLAP>
      <TONGTIEN>120000</TONGTIEN>
      <MANV>NV02</MANV>
      <TENBAN>B02</TENBAN>
    </HOADON>
    <HOADON>
      <SOHD>3</SOHD>
      <NGAYLAP>2025-10-02</NGAYLAP>
      <TONGTIEN>90000</TONGTIEN>
      <MANV>NV03</MANV>
      <TENBAN>B03</TENBAN>
    </HOADON>
    <HOADON>
      <SOHD>4</SOHD>
      <NGAYLAP>2025-10-03</NGAYLAP>
      <TONGTIEN>110000</TONGTIEN>
      <MANV>NV04</MANV>
      <TENBAN>B04</TENBAN>
    </HOADON>
    <HOADON>
      <SOHD>5</SOHD>
      <NGAYLAP>2025-10-03</NGAYLAP>
      <TONGTIEN>200000</TONGTIEN>
      <MANV>NV05</MANV>
      <TENBAN>B05</TENBAN>
    </HOADON>
  </HOADONS>

  <!-- CHI TIẾT HÓA ĐƠN -->
  <CTHDS>
    <CTHD>
      <SOHD>1</SOHD>
      <MAMON>M01</MAMON>
      <SOLUONG>2</SOLUONG>
    </CTHD>
    <CTHD>
      <SOHD>1</SOHD>
      <MAMON>M02</MAMON>
      <SOLUONG>1</SOLUONG>
    </CTHD>
    <CTHD>
      <SOHD>2</SOHD>
      <MAMON>M03</MAMON>
      <SOLUONG>3</SOLUONG>
    </CTHD>
    <CTHD>
      <SOHD>3</SOHD>
      <MAMON>M05</MAMON>
      <SOLUONG>2</SOLUONG>
    </CTHD>
    <CTHD>
      <SOHD>4</SOHD>
      <MAMON>M04</MAMON>
      <SOLUONG>1</SOLUONG>
    </CTHD>
  </CTHDS>

</QUANAN>
